{
  "record_id": "fl.hvac",
  "schema_version": "1.0.0",
  "state": "FL",
  "state_name": "Florida",
  "trade": "hvac",
  "jurisdiction_model": {
    "level": "state_and_local",
    "summary": {
      "value": "Two tiers. A CERTIFIED contractor (occupation code beginning C) may contract anywhere in Florida without meeting local competency requirements. A REGISTERED contractor (code beginning R) may contract only in the cities and counties their registration names. Same trade, same board, completely different geographic scope and a different renewal year.",
      "status": "verified",
      "confidence": "high",
      "source_url": "https://www2.myfloridalicense.com/construction-industry/",
      "source_title": "Construction Industry — Florida DBPR / CILB",
      "source_kind": "board_page",
      "evidence": "Registered contractors may contract only in such jurisdictions.",
      "last_verified": "2026-09-03",
      "verified_by": [
        "po-stateready-pass-a",
        "po-stateready-pass-b"
      ]
    },
    "local_layer_note": "A registered contractor entering a new Florida county is doing a licensing project, not a paperwork update. This is the single most common Florida surprise for an out-of-state buyer, and it is why the Florida playbook opens with the certified-versus-registered decision rather than with fees."
  },
  "boards": [
    {
      "board_id": "fl.cilb",
      "name": "Florida Department of Business and Professional Regulation — Construction Industry Licensing Board",
      "url": "https://www2.myfloridalicense.com/construction-industry/",
      "scope": "Air conditioning (Class A/B/C), mechanical, plumbing, roofing, sheet metal, general, building, residential, pool and specialty contractors",
      "phone": "850.487.1395"
    }
  ],
  "licence_types": [
    {
      "licence_type_id": "fl.hvac.certified_class_a_ac",
      "name": "Certified Class A Air-Conditioning Contractor (CA)",
      "level": "contractor",
      "issuer_level": "state",
      "board_id": "fl.cilb",
      "who_must_hold": {
        "value": "A contractor installing, maintaining, repairing, fabricating, altering, extending or designing central air-conditioning, refrigeration, heating and ventilating systems anywhere in Florida.",
        "status": "verified",
        "confidence": "high",
        "source_url": "https://www2.myfloridalicense.com/construction-industry/",
        "source_title": "Construction Industry — Florida DBPR / CILB",
        "source_kind": "board_page",
        "evidence": "a contractor whose services are unlimited in the execution of contracts requiring the experience, knowledge, and skill to install",
        "last_verified": "2026-09-03",
        "verified_by": [
          "po-stateready-pass-a",
          "po-stateready-pass-b"
        ]
      },
      "scope_note": {
        "value": "Unlimited as to system size. May not do LP or natural gas fuel lines inside buildings, potable water lines or connections, sanitary sewer lines, pool piping and filters, or electrical power wiring.",
        "status": "verified",
        "confidence": "high",
        "source_url": "https://www2.myfloridalicense.com/construction-industry/",
        "source_title": "Construction Industry — Florida DBPR / CILB",
        "source_kind": "board_page",
        "evidence": "shall not perform any work such as liquefied petroleum or natural gas fuel lines within buildings",
        "last_verified": "2026-09-03",
        "verified_by": [
          "po-stateready-pass-a",
          "po-stateready-pass-b"
        ]
      },
      "exam": {
        "required": {
          "value": true,
          "status": "verified",
          "confidence": "high",
          "source_url": "https://www.myfloridalicense.com/CheckListDetail.asp?SID=&xactCode=1042&clientCode=0601&XACT_DEFN_ID=18292",
          "source_title": "Certified Air Conditioning Contractor as an Individual – Active (CILB 5-G/5-H) checklist",
          "source_kind": "board_page",
          "evidence": "must first take and pass a state certification examination",
          "last_verified": "2026-09-03",
          "verified_by": [
            "po-stateready-pass-a",
            "po-stateready-pass-b"
          ]
        },
        "fee": {
          "value": null,
          "status": "unknown",
          "confidence": "low",
          "note": "The examination fee is not printed on the DBPR checklist page; it is set in the application and by the exam vendor. Not guessed."
        }
      },
      "experience": {
        "requirement": {
          "value": "Four years of experience, or a combination of college and experience.",
          "status": "verified",
          "confidence": "high",
          "source_url": "https://www.myfloridalicense.com/CheckListDetail.asp?SID=&xactCode=1042&clientCode=0601&XACT_DEFN_ID=18292",
          "source_title": "Certified Air Conditioning Contractor as an Individual – Active (CILB 5-G/5-H) checklist",
          "source_kind": "board_page",
          "evidence": "Applicants are required to have four years of experience or a combination of college and experience.",
          "last_verified": "2026-09-03",
          "verified_by": [
            "po-stateready-pass-a",
            "po-stateready-pass-b"
          ],
          "note": "The checklist states expressly that this is not the complete list; the application instruction pages govern. Confidence high on the four years, low on completeness."
        },
        "alternatives": {
          "value": "Military experience may be counted, with a Military Service Verification Form.",
          "status": "verified",
          "confidence": "high",
          "source_url": "https://www.myfloridalicense.com/CheckListDetail.asp?SID=&xactCode=1042&clientCode=0601&XACT_DEFN_ID=18292",
          "source_title": "Certified Air Conditioning Contractor as an Individual – Active (CILB 5-G/5-H) checklist",
          "source_kind": "board_page",
          "evidence": "Experience gained in the military may be used toward the requirements for licensure.",
          "last_verified": "2026-09-03",
          "verified_by": [
            "po-stateready-pass-a",
            "po-stateready-pass-b"
          ]
        }
      },
      "application_fee": {
        "value": null,
        "status": "unknown",
        "confidence": "low",
        "note": "DBPR's checklist says only 'Pay the required fee as provided in the application'. The CILB 5-G/5-H PDF is an image form with no extractable fee text, and rule 61G4-12.011 turned out to be Definitions rather than Fees. Two attempts, then stopped. Left empty rather than carrying over a third-party guide's number.",
        "source_url": "https://www.myfloridalicense.com/CheckListDetail.asp?SID=&xactCode=1042&clientCode=0601&XACT_DEFN_ID=18292"
      },
      "renewal": {
        "cycle": {
          "value": 24,
          "unit": "months",
          "status": "verified",
          "confidence": "high",
          "source_url": "https://www2.myfloridalicense.com/construction-industry/",
          "source_title": "Construction Industry — Florida DBPR / CILB",
          "source_kind": "board_page",
          "evidence": "Licenses expire August 31st every even year.",
          "last_verified": "2026-09-03",
          "verified_by": [
            "po-stateready-pass-a",
            "po-stateready-pass-b"
          ]
        },
        "fee": {
          "value": 205,
          "unit": "USD",
          "status": "verified",
          "confidence": "high",
          "source_url": "https://www2.myfloridalicense.com/construction-industry/",
          "source_title": "Construction Industry — Florida DBPR / CILB",
          "source_kind": "board_page",
          "evidence": "$205 (+$50 per qualified business)",
          "last_verified": "2026-09-03",
          "verified_by": [
            "po-stateready-pass-a",
            "po-stateready-pass-b"
          ],
          "note": "The +$50 per qualified business is not optional for a roll-up: a qualifier who qualifies six acquired entities pays $205 + 6 x $50."
        },
        "expiry_rule": {
          "value": "fixed_date_parity:08-31:even",
          "status": "verified",
          "confidence": "high",
          "source_url": "https://www2.myfloridalicense.com/construction-industry/",
          "source_title": "Construction Industry — Florida DBPR / CILB",
          "source_kind": "board_page",
          "evidence": "Licenses expire August 31st every even year.",
          "last_verified": "2026-09-03",
          "verified_by": [
            "po-stateready-pass-a",
            "po-stateready-pass-b"
          ],
          "note": "Certified licences expire 31 August of EVEN years; registered licences 31 August of ODD years. Two contractors in the same Florida branch, same trade, can be a year apart. The engine needs a parity parameter, not just a month and day."
        },
        "grace_period": {
          "value": null,
          "status": "unknown",
          "confidence": "low",
          "note": "Not stated on the DBPR page; delinquent and null-and-void paths exist but were not read in this pass."
        }
      },
      "continuing_education": {
        "required": {
          "value": true,
          "status": "verified",
          "confidence": "high",
          "source_url": "https://www2.myfloridalicense.com/construction-industry/",
          "source_title": "Construction Industry — Florida DBPR / CILB",
          "source_kind": "board_page",
          "evidence": "Complete the continuing education requirement",
          "last_verified": "2026-09-03",
          "verified_by": [
            "po-stateready-pass-a",
            "po-stateready-pass-b"
          ]
        },
        "hours": {
          "value": 14,
          "unit": "hours",
          "status": "verified",
          "confidence": "high",
          "source_url": "https://www2.myfloridalicense.com/construction-industry/",